course_title,course_id,course_avg_ratings,num_course_subscribers,num_course_reviews,course_length,course_language,course_type,course_instructor,course_instructor_id,num_course_instructor,num_course_lectures,course_publsihed_date,course_updated_date,course_list_price_inr,course_current_price_inr,course_instructional_level,course_category,course_label,is_course_bestseller,course_headline,course_url,course_image_url
Affinity Designer: The Complete Guide to Affinity Designer,1407170,4.6,44000,4377,14 hours,English,Paid,Jeremy Hazel and Video School,"28389536, 19701574",2,140,2017-12-19,2022-11-09,3499.0,449.0,All Levels,Design,Affinity Designer,No,You can start using Affinity Designer V2 to start designing beautifully,https://www.udemy.com/course/affinity-designer-the-complete-guide-to-affinity-designer/,https://img-c.udemycdn.com/course/750x422/1407170_febb_3.jpg
Learn to Create Pixel Art for your Games,522596,4.68,19894,4367,5.5 hours,English,Paid,Benjamin Anderson,6813534,1,48,2016-01-04,2021-04-10,2299.0,449.0,Beginner Level,Design,Pixel Art,No,Improve your pixel art with these simple techniques and principles.,https://www.udemy.com/course/learn-to-create-pixel-art-for-your-game/,https://img-c.udemycdn.com/course/750x422/522596_f45e.jpg
How to Draw Cute Cartoon Characters,62497,4.67,21759,4294,2.5 hours,English,Paid,Ben Colefax,912787,1,27,2013-10-01,2020-06-15,2499.0,449.0,All Levels,Design,Cartoon Drawing,No,Learn the secrets to drawing cute cartoons quickly and easily,https://www.udemy.com/course/draw-cute-characters/,https://img-c.udemycdn.com/course/750x422/62497_e0f1_8.jpg
Canva Master Course | Learn Canva with Ronny,1626712,4.7,23103,4239,16.5 hours,English,Paid,Ronny Hermosa,26625950,1,79,2018-07-02,2022-10-03,3499.0,449.0,All Levels,Design,Canva,Yes,"Discover Canva, Build your Brand & Grow your Business or Career with a Canva Certified Expert",https://www.udemy.com/course/canva-master-course-graphic-design-for-beginners/,https://img-c.udemycdn.com/course/750x422/1626712_f569_3.jpg
The Complete Sketch 5 Course - Design Apps & Websites 2021,1855830,4.38,18734,4051,15.5 hours,English,Paid,Codestars • over 2 million students worldwide! and Rob Percival and Andrew Eddy and The Design Academy and Margot Dukes,"33231436, 4387876, 8800948, 50372790, 9284676",5,138,2018-08-22,2020-04-12,3499.0,449.0,All Levels,Design,Sketch Software,No,"Master Sketch software and learn a modern approach to designing mobile apps, websites, and everything UI/UX",https://www.udemy.com/course/sketchdesign/,https://img-c.udemycdn.com/course/750x422/1855830_155f_4.jpg
3ds Max + V-Ray: 3ds Max PRO in 6 hrs,269778,4.51,24081,4011,21 hours,English,Paid,Adam Zollinger,6783508,1,157,2014-08-26,2022-08-02,3499.0,449.0,Beginner Level,Design,3ds Max,Yes,"3ds Max intro course:  3Ds Max and V-Ray for creating 3D architectural imagery, from beginner to advanced",https://www.udemy.com/course/intro-to-architectural-visualization-using-3ds-max-and-v-ray_zillus/,https://img-c.udemycdn.com/course/750x422/269778_a286_16.jpg
Environment Art School: Complete Perspective Drawing Course,2068907,4.69,32301,3997,10 hours,English,Paid,"Scott Harris • 450,000+ Enrolments",9055848,1,51,2018-12-07,2022-10-17,3499.0,449.0,Beginner Level,Design,Drawing,Yes,"Learn How To Draw Landscapes, How to Draw Perspective, How to Draw Backgrounds and How to Draw Scenes and Create Worlds",https://www.udemy.com/course/perspective-art-school-environment-landscape-drawing-course/,https://img-c.udemycdn.com/course/750x422/2068907_8958_3.jpg
Logo Design in Adobe Illustrator - for Beginners & Beyond,595876,4.46,21068,3988,17.5 hours,English,Paid,Daniel Evans,5108286,1,266,2015-10-01,2022-09-08,3499.0,449.0,All Levels,Design,Logo Design,No,"Learn how to design a logo by a Published, Multi-Award Winning Logo Designer! 21+ Years Experience!",https://www.udemy.com/course/logodesign/,https://img-c.udemycdn.com/course/750x422/595876_f52f_20.jpg
Gamification & Behavioral Design: The Octalysis Framework,852028,4.61,21837,3926,3 hours,English,Paid,Yu-kai Chou,470636,1,21,2016-07-25,2019-02-19,7500.0,7500.0,All Levels,Design,User Experience Design,Yes,"Learn the 8 Core Drives that motivate us all (beyond Points, Badges, and Leaderboards)",https://www.udemy.com/course/gamification-behavioral-design-the-octalysis-framework/,https://img-c.udemycdn.com/course/750x422/852028_f146_3.jpg
Complete Houdini FX 19 Bootcamp,1227634,4.61,17108,3900,18 hours,English,Paid,Raffi Bedross,9859504,1,195,2017-06-07,2022-03-18,3499.0,449.0,Beginner Level,Design,Houdini Software,Yes,Beginners guide to Houdini FX 19 : The most powerful 3D application in the world. No prior knowledge required.,https://www.udemy.com/course/houdini-create-full-cg-chocolate-commercial-in-houdini/,https://img-c.udemycdn.com/course/750x422/1227634_053c_20.jpg
After Effects CC: The Ultimate Motion Graphics Masterclass,973762,4.64,94441,3772,23.5 hours,English,Paid,Louay Zambarakji,15601054,1,263,2016-12-19,2022-11-14,3499.0,449.0,All Levels,Design,Motion Graphics,No,Create Motion Graphics with Adobe After Effects CC: Best Techniques and Methods to Become a Top Motion Graphics Designer,https://www.udemy.com/course/adobe-after-effects-2017-essential-motion-graphics-training/,https://img-c.udemycdn.com/course/750x422/973762_010a_12.jpg
"Graphic Design MasterClass- Photoshop, Illustrator, Indesign",1622484,4.44,99593,3710,34.5 hours,English,Paid,Khalil Ibrahim,16989726,1,212,2018-04-23,2022-11-08,3199.0,449.0,Beginner Level,Design,Graphic Design,No,"Graphic design for beginners including Graphic Design Theories, Photoshop, Illustrator, Indesign, CC & Creative Thinking",https://www.udemy.com/course/illustrator-cc-2018-for-beginners-basics-tricks/,https://img-c.udemycdn.com/course/750x422/1622484_652b_2.jpg
Complete Wordpress Training For Beginners,62768,3.8,39626,3707,4 hours,English,Paid,Eduonix Learning Solutions and Eduonix-Tech .,"598757, 15712140",2,20,2013-07-02,2018-12-04,799.0,449.0,All Levels,Design,WordPress,No,Learn to Build Wordpress Websites and Blogs from Scratch,https://www.udemy.com/course/complete-wordpress-course-for-beginners/,https://img-c.udemycdn.com/course/750x422/62768_bb14_8.jpg
Complete Beginner's Guide to Anatomy and Figure Drawing pt1,880202,4.62,24561,3682,38.5 hours,English,Paid,Rich Graysonn,5520332,1,226,2016-06-20,2022-11-11,3499.0,449.0,Beginner Level,Design,Figure Drawing,No,Learn the Basics of anatomy and figure Drawing,https://www.udemy.com/course/anatomy-and-figure-drawing-for-games-and-comics/,https://img-c.udemycdn.com/course/750x422/880202_d1eb_4.jpg
Information Architecture (IA) Fundamentals,936690,4.42,17375,3685,2.5 hours,English,Paid,Joe Natoli,402489,1,30,2016-08-22,2016-08-25,1999.0,449.0,Beginner Level,Design,Information Architecture,Yes,Everything you need to know — from what content should be presented to what it’s called to how it’s organized!,https://www.udemy.com/course/ia-fundamentals/,https://img-c.udemycdn.com/course/750x422/936690_a231_3.jpg
UI/UX design with Adobe XD: Design & Prototype a Mobile App,1033446,4.56,11960,3641,2 hours,English,Paid,Luca Vavassori,16405580,1,14,2017-02-23,2017-11-06,1699.0,449.0,All Levels,Design,Adobe XD,No,Learn how to design a beautiful and engaging mobile app with Adobe Experience Design (XD). Learn-by-doing approach.,https://www.udemy.com/course/adobe-xd-course/,https://img-c.udemycdn.com/course/750x422/1033446_4080_2.jpg
AutoCAD Beginners Course,1570296,4.65,14656,3626,11.5 hours,English,Paid,Mike Freeman,34054694,1,78,2018-03-02,2022-05-26,3499.0,449.0,All Levels,Design,AutoCAD,No,Learn to use AutoCAD quickly & professionally by creating as you learn,https://www.udemy.com/course/autocad-2018-getting-started-quickly-with-autocad/,https://img-c.udemycdn.com/course/750x422/1570296_8091_7.jpg
Sketching for UX Designers - Boost UX work with pen & paper!,1170144,4.49,20458,3613,4.5 hours,English,Paid,Krisztina Szerovay and István Szép and Gergely Szerovay,"4982624, 7495694, 22389270",3,51,2017-04-15,2019-11-15,3299.0,449.0,All Levels,Design,User Experience Design,No,"Learn how to boost your UX design workflow with sketching user interfaces, animations and storyboarding.",https://www.udemy.com/course/sketching-for-ux-designers/,https://img-c.udemycdn.com/course/750x422/1170144_57f7_5.jpg
Master SketchUp  - A Definitive Guide From Infinite Skills,222122,4.38,15735,3507,5.5 hours,English,Paid,Infinite Skills,39032,1,111,2014-05-23,2017-01-06,2299.0,449.0,All Levels,Design,SketchUp,No,A easy to follow SketchUp course that teaches using practical examples.,https://www.udemy.com/course/master-sketchup/,https://img-c.udemycdn.com/course/750x422/222122_ad46_6.jpg
Logo Design Mastery In Adobe Illustrator,2401332,4.71,15997,3408,6 hours,English,Paid,Lindsay Marsh,16146540,1,45,2019-06-08,2022-09-09,3499.0,449.0,All Levels,Design,Logo Design,Yes,"Learn Logo Design Theory, The Creative Process, How to Work With Clients & Master Adobe Illustrator Tools",https://www.udemy.com/course/logo-design-mastery-in-adobe-illustrator/,https://img-c.udemycdn.com/course/750x422/2401332_0c50_11.jpg
Graphic Design Masterclass Intermediate: The NEXT Level,1824130,4.71,35568,3404,17 hours,English,Paid,Lindsay Marsh,16146540,1,133,2018-08-01,2021-10-05,3499.0,449.0,Intermediate Level,Design,Graphic Design,No,"Up Your Graphic Design Skills: Logo Design, Photo Manipulation, Package Design, Infographics, Portfolio Building, Grids!",https://www.udemy.com/course/graphic-design-masterclass-the-next-level/,https://img-c.udemycdn.com/course/750x422/1824130_66e3_3.jpg
Ultimate Guide to Digital Sketching: Beginner to Advanced,1325264,4.6,34007,3403,5.5 hours,English,Paid,Austin Batchelor,21756796,1,42,2017-09-26,2019-11-26,3499.0,449.0,All Levels,Design,Sketching,No,Learn to digitally draw like a pro!,https://www.udemy.com/course/ultimate-guide-to-digital-sketching-beginner-to-advanced/,https://img-c.udemycdn.com/course/750x422/1325264_6025_3.jpg
Learn Zbrush-Ultimate course 4 beginners/intermediate,1158660,4.74,14825,3278,34 hours,English,Paid,Milivoj Popovic,30663554,1,153,2019-04-02,2021-12-27,3399.0,449.0,Beginner Level,Design,zBrush,Yes,Zbrush Made Easy! Ultimate Zbrush 3d sculpting course for beginners/intermediate.,https://www.udemy.com/course/sculpting-in-zbrush/,https://img-c.udemycdn.com/course/750x422/1158660_b2f4_13.jpg
Adobe InDesign CC: Your Complete Guide to InDesign,1351634,4.68,247188,3267,6 hours,English,Paid,Phil Ebiner and Kurt Anderson and Video School,"317821, 16779544, 19701574",3,53,2017-10-13,2022-08-05,799.0,449.0,All Levels,Design,InDesign,No,"Become an Adobe InDesign CC Master: Learn the complete InDesign workflow to create PDFs, eBooks, pamphlets, and more!",https://www.udemy.com/course/adobe-indesign-course/,https://img-c.udemycdn.com/course/750x422/1351634_7dc7_5.jpg
Cinema 4D Masterclass: The Ultimate Guide for Beginners,1832808,4.73,11720,3259,8 hours,English,Paid,Ozgur Gorgun,47946074,1,89,2018-08-21,2021-09-01,2699.0,449.0,All Levels,Design,Cinema 4D,Yes,"Take your design skills to the next level, into the 3rd Dimension with this Cinema 4D Course",https://www.udemy.com/course/cinema-4d-masterclass-training-course/,https://img-c.udemycdn.com/course/750x422/1832808_2d0c_4.jpg
Fundamentals of Garden Design,1242820,4.55,13432,3217,6.5 hours,English,Paid,Rob Littlepage,4396732,1,75,2017-08-30,2022-08-07,2299.0,449.0,All Levels,Design,Landscape Architecture,Yes,An Introduction to Landscape Architecture and Design,https://www.udemy.com/course/fundamentals-of-garden-design/,https://img-c.udemycdn.com/course/750x422/1242820_a019.jpg
Adobe InDesign CC - Advanced Training Course,1512990,4.81,23389,3194,8.5 hours,English,Paid,Daniel Walter Scott,11614232,1,74,2018-01-22,2021-11-15,3499.0,449.0,Intermediate Level,Design,InDesign,No,"This Adobe InDesign tutorial is people wanting to up-skill their typography, color theory & graphic design abilities.",https://www.udemy.com/course/adobe-indesign-cc-advanced-training/,https://img-c.udemycdn.com/course/750x422/1512990_9384_2.jpg
