course_title,course_id,course_avg_ratings,num_course_subscribers,num_course_reviews,course_length,course_language,course_type,course_instructor,course_instructor_id,num_course_instructor,num_course_lectures,course_publsihed_date,course_updated_date,course_list_price_inr,course_current_price_inr,course_instructional_level,course_category,course_label,is_course_bestseller,course_headline,course_url,course_image_url
Drawing and Painting on the iPad with Procreate,1081714,4.73,67294,16343,5.5 hours,English,Paid,Brad Colbow,22304822,1,37,2017-02-26,2021-12-01,799.0,449.0,Beginner Level,Design,Procreate Digital Illustration App,Yes,Learn everything you need to know about Procreate with hands on drawing lessons. Now updated for Procreate 5.,https://www.udemy.com/course/drawing-and-painting-on-the-ipad-with-procreate/,https://img-c.udemycdn.com/course/750x422/1081714_3862.jpg
"Graphic Design Bootcamp: Photoshop, Illustrator, InDesign",749542,4.41,114940,15789,15.5 hours,English,Paid,Derrick Mitchell,10952512,1,98,2016-05-13,2020-11-22,3499.0,449.0,Beginner Level,Design,Graphic Design,No,"Bestselling Beginner Course! Use Photoshop, Illustrator, & InDesign for logo design, web design, poster design, and more",https://www.udemy.com/course/graphic-design-for-beginners/,https://img-c.udemycdn.com/course/750x422/749542_4762_3.jpg
"CSS - The Complete Guide 2023 (incl. Flexbox, Grid & Sass)",1561458,4.75,80440,15150,23 hours,English,Paid,Academind by Maximilian Schwarzmüller and Maximilian Schwarzmüller and Manuel Lorenz,"31926668, 13952972, 30035496",3,297,2018-03-19,2022-11-02,3499.0,449.0,All Levels,Design,CSS,Yes,Learn CSS for the first time or brush up your CSS skills and dive in even deeper. EVERY web developer has to know CSS.,https://www.udemy.com/course/css-the-complete-guide-incl-flexbox-grid-sass/,https://img-c.udemycdn.com/course/750x422/1561458_7f3b_2.jpg
"Complete Web & Mobile Designer in 2023: UI/UX, Figma, +more",3227583,4.59,86016,15087,28 hours,English,Paid,Andrei Neagoie and Daniel Schifano and Zero To Mastery,"38516954, 97703786, 173002169",3,346,2020-10-13,2022-11-09,3499.0,449.0,All Levels,Design,Mobile App Design,Yes,"Become a Designer in 2023! Master Mobile and Web Design, User Interface + User Experience (UI/UX Design), HTML, and CSS",https://www.udemy.com/course/complete-web-designer-mobile-designer-zero-to-mastery/,https://img-c.udemycdn.com/course/750x422/3227583_5e75_6.jpg
Adobe InDesign CC - Essentials Training Course,1316728,4.71,56625,14826,7.5 hours,English,Paid,Daniel Walter Scott,11614232,1,80,2017-08-16,2021-11-15,3499.0,449.0,Beginner Level,Design,InDesign,Yes,"Build company newsletters, brochures, annual reports. Learn typography, color theory & graphic design skills in InDesign",https://www.udemy.com/course/indesign-tutorial-basics-course/,https://img-c.udemycdn.com/course/750x422/1316728_26f9_6.jpg
The Complete Graphic Design Theory for Beginners Course,1864390,4.62,59311,14335,10 hours,English,Paid,"Lindsay Marsh and Jeremy Deighan - 265,000+ Students","16146540, 12589212",2,83,2018-10-18,2022-02-05,3499.0,449.0,Beginner Level,Design,Graphic Design,Yes,"Learn Graphic Design Theory and the Basic Principles of Color Theory, Typography, Branding, Logo Design, Layout & More!",https://www.udemy.com/course/graphic-design-theory-for-beginners-course/,https://img-c.udemycdn.com/course/750x422/1864390_96a5_2.jpg
"UX & Web Design Master Course: Strategy, Design, Development",412738,4.5,97846,14103,23.5 hours,English,Paid,Joe Natoli,402489,1,187,2015-08-25,2020-03-10,3499.0,449.0,All Levels,Design,User Experience Design,No,"Learn how to apply User Experience (UX) principles to your website designs, code a variety of sites, and increase sales!",https://www.udemy.com/course/ux-web-design-master-course-strategy-design-development/,https://img-c.udemycdn.com/course/750x422/412738_4543_2.jpg
The Ultimate Digital Painting Course - Beginner to Advanced,869812,4.56,85937,13841,27 hours,English,Paid,Jaysen Batchelor and Austin Batchelor,"17082766, 21756796",2,126,2019-07-25,2022-03-16,3499.0,449.0,All Levels,Design,Digital Painting,Yes,Everything from drawing fundamentals to professional painting techniques,https://www.udemy.com/course/the-ultimate-digital-painting-course-beginner-to-advanced/,https://img-c.udemycdn.com/course/750x422/869812_1fc8_3.jpg
User Experience Design Fundamentals,58207,4.46,95073,13658,10 hours,English,Paid,Joe Natoli,402489,1,54,2013-06-17,2019-12-12,3299.0,449.0,Beginner Level,Design,User Experience Design,No,Design Web Sites and Mobile Apps that Your Users Love and Return to Again and Again with UX Expert Joe Natoli.,https://www.udemy.com/course/user-experience-design-fundamentals/,https://img-c.udemycdn.com/course/750x422/58207_2ec2_7.jpg
Learn Figma - UI/UX Design Essential Training,1409030,4.58,51115,13321,3.5 hours,English,Paid,Caleb Kingston,25853456,1,47,2017-12-26,2020-11-12,3499.0,449.0,All Levels,Design,User Interface Design,No,Learn how to design a beautiful and engaging mobile app with Figma. Learn-by-doing approach.,https://www.udemy.com/course/learn-figma/,https://img-c.udemycdn.com/course/750x422/1409030_6722_4.jpg
After Effects CC Masterclass: Complete After Effects Course,927360,4.63,339386,12313,27 hours,English,Paid,Phil Ebiner and Video School,"317821, 19701574",2,217,2017-09-26,2022-08-06,799.0,449.0,All Levels,Design,After Effects,No,"Learn Beginner to Advanced Adobe After Effects CC: Motion Graphics, Kinetic Typography, Visual Effects VFX, Animation+",https://www.udemy.com/course/after-effects-cc/,https://img-c.udemycdn.com/course/750x422/927360_bab9_5.jpg
Creating 3D environments in Blender,683198,4.66,91190,11391,55.5 hours,English,Paid,Rob Tuytel and CG Obaid (Obaidur Rahman),"13342068, 137814074",2,373,2015-12-15,2022-11-02,3499.0,449.0,All Levels,Design,Blender,No,"Learn Blender 3.2, explore Geometry Nodes and create wonderful 3D environments",https://www.udemy.com/course/blender-environments/,https://img-c.udemycdn.com/course/750x422/683198_ef78_8.jpg
Crash Course Electronics and PCB Design,401998,4.68,60681,11246,109 hours,English,Paid,Andre LaMothe,9857260,1,157,2018-07-11,2022-07-26,3399.0,449.0,Beginner Level,Design,Electronics,Yes,Learn Electronics and PCB Design from the Ground up with Altium CircuitMaker and Labcenter Proteus,https://www.udemy.com/course/crash-course-electronics-and-pcb-design/,https://img-c.udemycdn.com/course/750x422/401998_6e4a.jpg
Complete Web Design: from Figma to Webflow to Freelancing,2094300,4.75,42889,10711,19.5 hours,English,Paid,Vako Shvili,20595220,1,201,2020-02-11,2022-09-23,3499.0,449.0,All Levels,Design,Web Design,Yes,"3 in 1 Course: Learn to design websites with Figma, build with Webflow, and make a living freelancing.",https://www.udemy.com/course/freelance-web-design-from-design-to-development-to-making-money/,https://img-c.udemycdn.com/course/750x422/2094300_ebf0_8.jpg
DESIGN RULES: Principles + Practices for Great UI Design,1595266,4.57,39183,10584,5 hours,English,Paid,Joe Natoli,402489,1,50,2018-05-29,2018-05-30,3399.0,449.0,All Levels,Design,User Interface Design,No,"Learn to design powerful user interfaces for apps, sites and systems",https://www.udemy.com/course/design-rules/,https://img-c.udemycdn.com/course/750x422/1595266_8fe6.jpg
Photoshop 2022 MasterClass,850426,4.71,57494,10444,14 hours,English,Paid,Martin Perhiniak,713757,1,117,2016-05-17,2022-01-05,3499.0,449.0,All Levels,Design,Photoshop,No,Master the World's Best Imaging and Design Application and Become an Adobe Certified Associate.,https://www.udemy.com/course/photoshop-cc-masterclass/,https://img-c.udemycdn.com/course/750x422/850426_5596_4.jpg
"The Complete App Design Course - UX, UI and Design Thinking",1184844,4.46,43701,10031,3 hours,English,Paid,App Brewery Co.,19949132,1,62,2017-04-19,2019-11-14,3499.0,449.0,Beginner Level,Design,Mobile App Design,No,"Learn App Design to Make Beautiful, Lovable Apps",https://www.udemy.com/course/the-complete-app-design-course-ux-and-ui-design/,https://img-c.udemycdn.com/course/750x422/1184844_3714.jpg
Sketch from A to Z (2022): Become an app designer,371074,4.62,36151,9900,4.5 hours,English,Paid,Joseph Angelo Todaro,9536018,1,60,2015-01-03,2021-08-22,3499.0,449.0,All Levels,Design,Sketch Software,Yes,Finally a comprehensive guide to using Sketch for designing mobile applications. Learn to design an app from A to Z.,https://www.udemy.com/course/learnsketch3/,https://img-c.udemycdn.com/course/750x422/371074_6c73_2.jpg
UX Design & User Experience Design Course - Theory Only,968750,4.48,31815,9559,2.5 hours,English,Paid,Daniel Walter Scott,11614232,1,29,2016-11-18,2019-07-21,3499.0,449.0,Beginner Level,Design,User Experience Design,No,This course is for anyone interested in learning the theory of UX design.,https://www.udemy.com/course/how-to-change-careers-and-become-a-ux-designer/,https://img-c.udemycdn.com/course/750x422/968750_196b_7.jpg
Figma UI UX Design Essentials,4359576,4.66,40268,9497,11.5 hours,English,Paid,Daniel Walter Scott,11614232,1,111,2021-11-02,2022-08-29,3499.0,449.0,All Levels,Design,User Experience Design,Yes,"Use Figma to get a job in UI Design, User Interface, User Experience design, UX Design & Web Design",https://www.udemy.com/course/figma-ux-ui-design-user-experience-tutorial-course/,https://img-c.udemycdn.com/course/750x422/4359576_b9e1_2.jpg
How to Work with Interior Design Styles Like a Pro,1136678,4.43,45578,9266,6 hours,English,Paid,Erikka Fogleman,19368416,1,42,2017-05-01,2022-10-20,3499.0,449.0,All Levels,Design,Interior Design,Yes,Interior Design Styles Demystified,https://www.udemy.com/course/learn-how-to-work-with-interior-design-styles-like-a-pro/,https://img-c.udemycdn.com/course/750x422/1136678_f12f_3.jpg
Adobe Photoshop CC – Advanced Training Course,1835828,4.77,56372,8718,16.5 hours,English,Paid,Daniel Walter Scott,11614232,1,111,2018-08-07,2022-06-20,3499.0,449.0,Intermediate Level,Design,Photoshop,No,You'll learn advanced Photoshop techniques like Photoshop retouching & Graphic Design tutorials.,https://www.udemy.com/course/adobe-photoshop-cc-advanced-training-course-tutorial/,https://img-c.udemycdn.com/course/750x422/1835828_92e5_2.jpg
Adobe Illustrator CC – Advanced Training Course,1623798,4.74,46280,8194,9.5 hours,English,Paid,Daniel Walter Scott,11614232,1,57,2018-04-04,2022-04-25,3499.0,449.0,Intermediate Level,Design,Adobe Illustrator,No,"In this Adobe Illustrator Advanced course we'll learn Advanced techniques for graphic design, logo design & illustration",https://www.udemy.com/course/adobe-illustrator-cc-advanced-training/,https://img-c.udemycdn.com/course/750x422/1623798_db31_4.jpg
WordPress Development with Bootstrap: The Complete Course,271228,4.21,52401,8184,22.5 hours,English,Paid,Brad Hussey,422607,1,133,2015-01-05,2022-02-21,3499.0,449.0,All Levels,Design,Bootstrap,Yes,"Become a WordPress Developer in 2022 and build beautiful, responsive WordPress Themes in PHP, JavaScript & Elementor.",https://www.udemy.com/course/bootstrap-to-wordpress/,https://img-c.udemycdn.com/course/750x422/271228_ce5b_9.jpg
Gamification: Motivation Psychology & The Art of Engagement,593074,4.54,26122,7903,3 hours,English,Paid,Rob Sutcliffe,2038768,1,46,2015-10-19,2020-08-24,3299.0,449.0,All Levels,Design,Gamification,No,Learn how to motivate and engage anyone by learning the psychology that underpins human behaviour.  ,https://www.udemy.com/course/gamification-motivation-psychology-the-art-of-engagement/,https://img-c.udemycdn.com/course/750x422/593074_ff12_4.jpg
Photoshop In-Depth: Master all of Photoshop's Tools Easily,348116,4.47,166917,7801,5.5 hours,English,Paid,"Chad Neuman, Ph.D.",8918328,1,53,2014-11-30,2021-03-24,2299.0,449.0,All Levels,Design,Photoshop,No,"Learn the many tools in Adobe Photoshop with in-depth lectures that explain the tool uses, options + modes in Photoshop.",https://www.udemy.com/course/photoshop-tools/,https://img-c.udemycdn.com/course/750x422/348116_e9d8_5.jpg
Become a Game Designer the Complete Series Coding to Design,526534,4.46,65129,7719,85 hours,English,Paid,[ School of Game Design ],1090084,1,710,2015-09-14,2022-01-13,3499.0,449.0,All Levels,Design,Game Development Fundamentals,Yes,"Master Unity, 3D game design, 2D game design, coding, C#, game development, 3D animation, programming, level design...",https://www.udemy.com/course/become-a-game-designer/,https://img-c.udemycdn.com/course/750x422/526534_04bb_4.jpg
Autodesk Revit - beginner to an intermediate level,1777838,4.59,32969,7619,8 hours,English,Paid,S15 Studio,49898498,1,107,2018-07-24,2022-10-17,799.0,449.0,Beginner Level,Design,Revit,Yes,"Includes 1 main project, 15 quizzes & a Final Exam. For users of Revit 2018 and above",https://www.udemy.com/course/autodesk-revit-for-beginners-up-to-intermediate-level/,https://img-c.udemycdn.com/course/750x422/1777838_f79b.jpg
Adobe Premiere Pro CC – Essentials Training Course,3074134,4.75,29873,7384,16 hours,English,Paid,Daniel Walter Scott,11614232,1,140,2020-05-04,2022-05-26,3499.0,449.0,Beginner Level,Design,Adobe Premiere,Yes,Start your Premiere Pro training now and fast track your career as a video editor.,https://www.udemy.com/course/adobe-premiere-pro-cc-essentials-training-course/,https://img-c.udemycdn.com/course/750x422/3074134_4c5f_2.jpg
Landing Page Design & Conversion Rate Optimization 2018,1048360,4.82,41504,7382,9.5 hours,English,Paid,Isaac Rudansky,17682090,1,49,2016-12-22,2021-10-06,3499.0,449.0,All Levels,Design,Landing Page Optimization,Yes,Triple Your Conversion Rate With These Landing Page Design Principles & Build A Landing Page From Scratch With No Code,https://www.udemy.com/course/landing-page-design-best-practices/,https://img-c.udemycdn.com/course/750x422/1048360_8a17.jpg
SOLIDWORKS: Become a Certified Associate Today (CSWA),551930,4.51,26970,7316,4.5 hours,English,Paid,Tayseer .,11643144,1,81,2015-09-07,2022-10-12,3499.0,449.0,Beginner Level,Design,SOLIDWORKS,Yes,SolidWorks Training: Learn to Master SolidWorks to the Associate Certification Level Even if You are a Complete Beginner,https://www.udemy.com/course/solidwokrs-go-from-nothing-to-certified-associate-level/,https://img-c.udemycdn.com/course/750x422/551930_3c01_2.jpg
After Effects - Motion Graphics & Data Visualization,1329786,4.7,39305,7146,6.5 hours,English,Paid,Daniel Walter Scott,11614232,1,50,2017-08-28,2021-11-15,3499.0,449.0,All Levels,Design,After Effects,Yes,"Using Adobe After Effects create beautiful VFX Visual Effects, data visualization & VFX Compositing.",https://www.udemy.com/course/animated-infographic-video-data-visualisation/,https://img-c.udemycdn.com/course/750x422/1329786_8aa9_7.jpg
Designing for 3D Printing with Fusion 360,958668,4.61,24686,7094,4 hours,English,Paid,Vladimir Mariano,15930246,1,28,2016-09-18,2021-07-19,3499.0,449.0,Beginner Level,Design,3D Printing,Yes,Learn to design for 3D printing with my easy to follow video lessons using Fusion 360,https://www.udemy.com/course/designing-for-3d-printing-with-fusion-360/,https://img-c.udemycdn.com/course/750x422/958668_ecfb.jpg
How to Design a Room in 10 Easy Steps,871756,4.44,29300,7069,2 hours,English,Paid,Erikka Fogleman,19368416,1,36,2016-07-04,2022-10-20,3399.0,449.0,Beginner Level,Design,Interior Design,No,Interior Design Made Simple,https://www.udemy.com/course/how-to-design-a-room-in-10-easy-steps/,https://img-c.udemycdn.com/course/750x422/871756_5356_3.jpg
The Blender 2.8 Encyclopedia,2302354,4.7,34644,6975,52 hours,English,Paid,Lee Salvemini and Chris Plush and CG Masters,"1007344, 8229906, 77895906",3,403,2020-05-12,2022-07-06,3499.0,449.0,All Levels,Design,3D Animation,Yes,Complete beginner-to-advanced guide for Blender 2.8 and 2.9,https://www.udemy.com/course/the-blender-encyclopedia/,https://img-c.udemycdn.com/course/750x422/2302354_4ddd_8.jpg
Pixel Art Master Course - Beginner to Professional/Freelance,1772094,4.66,37615,6889,21.5 hours,English,Paid,Mislav Majdandžić,32208768,1,198,2018-07-11,2022-10-09,3499.0,449.0,All Levels,Design,Pixel Art,Yes,Learn ALL about pixel art in an always growing course! Get access to basic and pro techniques with daily feedbacks!,https://www.udemy.com/course/pixel-art-master-course/,https://img-c.udemycdn.com/course/750x422/1772094_5669_4.jpg
WordPress for Beginners: Create a Website Step by Step,1010580,4.71,19633,6528,4.5 hours,English,Paid,Brad Schiff,5993622,1,24,2017-03-11,2021-03-11,3099.0,449.0,Beginner Level,Design,WordPress,No,Create Websites and Blogs With Zero Experience Using WordPress and This Step By Step Guide,https://www.udemy.com/course/wordpress-for-beginners-create-a-website-blog-step-by-step/,https://img-c.udemycdn.com/course/750x422/1010580_b7ba_4.jpg
Adobe Premiere Pro CC: Video Editing in Adobe Premiere Pro,962108,4.71,75880,6469,10 hours,English,Paid,Louay Zambarakji,15601054,1,114,2017-08-15,2019-01-05,3499.0,449.0,All Levels,Design,Adobe Premiere,Yes,Learn Video Editing in Adobe Premiere Pro with Color Correction & Color Grading and Professional Video Editing practices,https://www.udemy.com/course/adobe-premiere-pro-cc-2017-video-editing/,https://img-c.udemycdn.com/course/750x422/962108_2170_10.jpg
Master Digital Product Design: UX Research & UI Design,2650928,4.57,29473,6392,15.5 hours,English,Paid,Rob Sutcliffe,2038768,1,168,2019-11-15,2021-11-25,3499.0,449.0,All Levels,Design,Product Design,Yes,"A complete design education for product designers: Research the user experience, then design a great user interface",https://www.udemy.com/course/master-digital-product-design-ux-research-ui-design/,https://img-c.udemycdn.com/course/750x422/2650928_8d24_6.jpg
Maya for Beginners: Complete Guide to 3D Animation in Maya,1556128,4.62,31437,6382,26.5 hours,English,Paid,Video School and Lucas Ridley,"19701574, 12404874",2,151,2018-09-01,2022-08-06,3499.0,449.0,All Levels,Design,Maya,Yes,"Learn everything you need for 3D animation in Autodesk Maya: Modeling, Texturing, Lighting, Rigging, Animation, Dynamics",https://www.udemy.com/course/autodesk-maya-3d-animation-course/,https://img-c.udemycdn.com/course/750x422/1556128_9d8f_4.jpg
"Learn Photoshop, Web Design & Profitable Freelancing 2022",957940,4.59,45785,6366,24.5 hours,English,Paid,Cristian Doru Barin,342181,1,243,2016-11-30,2022-09-24,3499.0,449.0,All Levels,Design,Photoshop,Yes,"Learn Adobe Photoshop and use it to create amazing website designs and create a high, stable income. No coding needed!",https://www.udemy.com/course/learn-photoshop-web-design-profitable-freelancing/,https://img-c.udemycdn.com/course/750x422/957940_4115_4.jpg
User Experience (UX): The Ultimate Guide to Usability and UX,28258,4.56,22259,6313,12 hours,English,Paid,David Travis,421658,1,156,2013-01-22,2020-04-01,2999.0,2999.0,All Levels,Design,User Experience Design,No,Get a job in UX and build your user research and UX design skills with this hands-on user experience training course.,https://www.udemy.com/course/ultimate-guide-to-ux/,https://img-c.udemycdn.com/course/750x422/28258_8a7e_14.jpg
Photoshop Beginners Mastery: Zero to Hero in Photoshop,348146,4.45,218285,6274,3 hours,English,Paid,"Chad Neuman, Ph.D.",8918328,1,46,2014-11-29,2020-05-08,2299.0,449.0,Beginner Level,Design,Photoshop,No,Learn Photoshop quickly and easily with essentials of Adobe Photoshop to produce beautiful images in Adobe Photoshop.,https://www.udemy.com/course/getting-started-in-photoshop/,https://img-c.udemycdn.com/course/750x422/348146_9dc0_7.jpg
Anatomy for Figure Drawing: Mastering the Human Figure,62721,4.44,65824,5853,65 hours,English,Paid,Neil Fontaine,168855,1,65,2013-10-16,2020-08-09,3299.0,449.0,All Levels,Design,Figure Drawing,Yes,This is what you need to learn in order to draw figures like a pro and land that dream job.,https://www.udemy.com/course/anatomy-for-figure-drawing-and-comics/,https://img-c.udemycdn.com/course/750x422/62721_eed7_11.jpg
Learn Adobe Photoshop from Scratch,270816,4.35,85431,5589,8 hours,English,Paid,Eduonix Learning Solutions and Eduonix-Tech .,"598757, 15712140",2,37,2015-09-23,2018-12-04,799.0,449.0,Beginner Level,Design,Photoshop,No,The Complete Beginners Guide for Learning Adobe Photoshop,https://www.udemy.com/course/learn-adobe-photoshop-from-scratch/,https://img-c.udemycdn.com/course/750x422/270816_7956_3.jpg
Rhino 3D ( any version )  Beginner Level to Advanced Level,1341284,4.59,22000,5564,35 hours,English,Paid,Alexandre Galin,35888066,1,154,2017-09-07,2022-05-16,3499.0,449.0,All Levels,Design,Rhino 3D,Yes,Learn from the ground up with these easy to follow videos in Rhinoceros 3D. The videos are regularly updated,https://www.udemy.com/course/rhino-3d-tutorials-from-beginner-level-to-advanced-level/,https://img-c.udemycdn.com/course/750x422/1341284_638e_9.jpg
Character Art School: Complete Coloring and Painting,1324768,4.78,77782,5447,19.5 hours,English,Paid,"Scott Harris • 450,000+ Enrolments",9055848,1,83,2017-08-22,2022-10-17,3499.0,449.0,Beginner Level,Design,Character Design,Yes,"The Best Way to Learn to Color and Paint Professional Characters for Animation, Games, Comics, Manga and More.",https://www.udemy.com/course/character-art-school-complete-coloring-and-painting/,https://img-c.udemycdn.com/course/750x422/1324768_af13_21.jpg
Photoshop Master Course: From Beginner to Photoshop Pro,16799,4.39,144357,5142,12.5 hours,English,Paid,Manfred Werner,167719,1,78,2012-04-24,2020-07-25,2299.0,449.0,Beginner Level,Design,Photoshop,No,This Adobe Photoshop Beginner Course will teach a Beginner Photoshop user all essentials of Adobe Photoshop CC,https://www.udemy.com/course/supreme-photoshop-training-from-beginner-to-expert/,https://img-c.udemycdn.com/course/750x422/16799_e077_20.jpg
How to Use Color Like a Pro,1014236,4.57,25153,5110,2 hours,English,Paid,Erikka Fogleman,19368416,1,26,2016-11-24,2021-11-12,3499.0,449.0,All Levels,Design,Interior Design,Yes,Interior Design Color Schemes Made Easy,https://www.udemy.com/course/learn-how-to-use-color-like-a-pro/,https://img-c.udemycdn.com/course/750x422/1014236_3867_3.jpg
Adobe Illustrator: Mastering the Fundamentals,65306,4.0,65668,5092,1.5 hours,English,Paid,[ School of Game Design ],1090084,1,29,2013-07-18,2018-11-27,2499.0,449.0,Beginner Level,Design,Adobe Illustrator,No,Learn powerful illustration techniques in Adobe Illustrator master digital painting and graphic design with new skills!,https://www.udemy.com/course/adobe-illustrator-training/,https://img-c.udemycdn.com/course/750x422/65306_a9c7_5.jpg
Responsive Web Design Essentials - HTML5 CSS3 Bootstrap,2459618,4.7,20690,5031,16.5 hours,English,Paid,Daniel Walter Scott,11614232,1,126,2019-07-18,2021-12-19,3499.0,449.0,All Levels,Design,CSS,Yes,"The best course for learning the basics of HTML5 and CSS3 from scratch. Including 5 projects, perfect for beginners.",https://www.udemy.com/course/responsive-web-design-tutorial-course-html5-css3-bootstrap/,https://img-c.udemycdn.com/course/750x422/2459618_80a6.jpg
Manga Art School: Complete How to Draw Anime & Manga Course,1630508,4.41,30858,4950,11.5 hours,English,Paid,"Scott Harris • 450,000+ Enrolments",9055848,1,53,2018-04-20,2022-10-17,3499.0,449.0,Beginner Level,Design,Character Design,Yes,"Learn how to draw anime and how to draw manga, easily and professionally in this Manga Art Course",https://www.udemy.com/course/manga-art-school-anime-and-manga-style-character-drawing/,https://img-c.udemycdn.com/course/750x422/1630508_94eb_7.jpg
WordPress for Beginners: Create Your Own WordPress Website,1109602,4.4,220094,4860,8 hours,English,Paid,Phil Ebiner and Video School,"317821, 19701574",2,102,2017-03-11,2022-07-19,799.0,449.0,Beginner Level,Design,WordPress,No,Join our complete WordPress course to easily create a professional Wordpress website: no experience or coding necessary!,https://www.udemy.com/course/the-complete-wordpress-for-beginners-course/,https://img-c.udemycdn.com/course/750x422/1109602_1ef3_8.jpg
Complete Beginner's Guide to Digital Art,327666,4.44,33360,4716,23.5 hours,English,Paid,Rich Graysonn,5520332,1,126,2016-02-14,2022-02-24,3499.0,449.0,Beginner Level,Design,Digital Art,No,Master the foundations of digital drawing and illustration and create art like a pro,https://www.udemy.com/course/digital-art-101-from-beginner-to-pro/,https://img-c.udemycdn.com/course/750x422/327666_82b2_2.jpg
How to Draw and Sketch for Absolute Beginners pt 1,1047436,4.56,24993,4586,13 hours,English,Paid,Rich Graysonn,5520332,1,111,2017-01-25,2022-06-09,3499.0,449.0,Beginner Level,Design,Sketching,Yes,Learn the Basics of Sketching and Drawing,https://www.udemy.com/course/drawing-and-sketching-for-beginners/,https://img-c.udemycdn.com/course/750x422/1047436_97b3.jpg
The Digital Painting MEGA Course: Beginner to Advanced,1458304,4.57,39055,4513,16 hours,English,Paid,Austin Batchelor,21756796,1,115,2018-02-26,2022-09-28,3499.0,449.0,All Levels,Design,Digital Painting,No,Learn to paint in 7 different styles!,https://www.udemy.com/course/the-digital-painting-mega-course-beginner-to-advanced/,https://img-c.udemycdn.com/course/750x422/1458304_7c2b_4.jpg
Complete course in AutoCAD : 2D and 3D,2563480,4.38,156837,4482,16.5 hours,English,Paid,CADCIM Technologies,82217048,1,202,2019-10-13,2020-03-03,1499.0,449.0,All Levels,Design,AutoCAD,No,"For Architects, Engineers, and Designers",https://www.udemy.com/course/autocad-2020-for-designers-a-problem-solving-approach/,https://img-c.udemycdn.com/course/750x422/2563480_04e4_5.jpg
UX Strategy Fundamentals,935870,4.47,16416,4399,2.5 hours,English,Paid,Joe Natoli,402489,1,33,2016-08-22,2016-08-22,1999.0,449.0,Beginner Level,Design,User Experience Design,No,"Practical principles and simple methods to make sure your app, site or system delivers GREAT UX!",https://www.udemy.com/course/ux-strategy-fundamentals/,https://img-c.udemycdn.com/course/750x422/935870_0bd8_3.jpg
