course_title,course_id,course_avg_ratings,num_course_subscribers,num_course_reviews,course_length,course_language,course_type,course_instructor,course_instructor_id,num_course_instructor,num_course_lectures,course_publsihed_date,course_updated_date,course_list_price_inr,course_current_price_inr,course_instructional_level,course_category,course_label,is_course_bestseller,course_headline,course_url,course_image_url
Photoshop Beginners Mastery: Zero to Hero in Photoshop,348146,4.42,218264,6271,3 hours,English,Paid,"Chad Neuman, Ph.D.",8918328,1,46,2014-11-29,2020-05-08,2299.0,449.0,Beginner Level,Design,Photoshop,No,Learn Photoshop quickly and easily with essentials of Adobe Photoshop to produce beautiful images in Adobe Photoshop.,https://www.udemy.com/course/getting-started-in-photoshop/,https://img-c.udemycdn.com/course/750x422/348146_9dc0_7.jpg
Anatomy for Figure Drawing: Mastering the Human Figure,62721,4.46,65776,5848,65 hours,English,Paid,Neil Fontaine,168855,1,65,2013-10-16,2020-08-09,3299.0,449.0,All Levels,Design,Figure Drawing,Yes,This is what you need to learn in order to draw figures like a pro and land that dream job.,https://www.udemy.com/course/anatomy-for-figure-drawing-and-comics/,https://img-c.udemycdn.com/course/750x422/62721_eed7_11.jpg
Learn Adobe Photoshop from Scratch,270816,4.35,85430,5589,8 hours,English,Paid,Eduonix Learning Solutions and Eduonix-Tech .,"598757, 15712140",2,37,2015-09-23,2018-12-04,799.0,449.0,Beginner Level,Design,Photoshop,No,The Complete Beginners Guide for Learning Adobe Photoshop,https://www.udemy.com/course/learn-adobe-photoshop-from-scratch/,https://img-c.udemycdn.com/course/750x422/270816_7956_3.jpg
Rhino 3D ( any version )  Beginner Level to Advanced Level,1341284,4.6,21936,5553,35 hours,English,Paid,Alexandre Galin,35888066,1,154,2017-09-07,2022-05-16,3499.0,449.0,All Levels,Design,Rhino 3D,Yes,Learn from the ground up with these easy to follow videos in Rhinoceros 3D. The videos are regularly updated,https://www.udemy.com/course/rhino-3d-tutorials-from-beginner-level-to-advanced-level/,https://img-c.udemycdn.com/course/750x422/1341284_638e_9.jpg
Character Art School: Complete Coloring and Painting,1324768,4.77,77725,5442,19.5 hours,English,Paid,"Scott Harris • 450,000+ Enrolments",9055848,1,83,2017-08-22,2022-10-17,3499.0,449.0,Beginner Level,Design,Character Design,Yes,"The Best Way to Learn to Color and Paint Professional Characters for Animation, Games, Comics, Manga and More.",https://www.udemy.com/course/character-art-school-complete-coloring-and-painting/,https://img-c.udemycdn.com/course/750x422/1324768_af13_21.jpg
Photoshop Master Course: From Beginner to Photoshop Pro,16799,4.36,144335,5136,12.5 hours,English,Paid,Manfred Werner,167719,1,78,2012-04-24,2020-07-25,2299.0,449.0,Beginner Level,Design,Photoshop,No,This Adobe Photoshop Beginner Course will teach a Beginner Photoshop user all essentials of Adobe Photoshop CC,https://www.udemy.com/course/supreme-photoshop-training-from-beginner-to-expert/,https://img-c.udemycdn.com/course/750x422/16799_e077_20.jpg
How to Use Color Like a Pro,1014236,4.57,25123,5105,2 hours,English,Paid,Erikka Fogleman,19368416,1,26,2016-11-24,2021-11-12,3499.0,449.0,All Levels,Design,Interior Design,Yes,Interior Design Color Schemes Made Easy,https://www.udemy.com/course/learn-how-to-use-color-like-a-pro/,https://img-c.udemycdn.com/course/750x422/1014236_3867_3.jpg
Adobe Illustrator: Mastering the Fundamentals,65306,4.05,65668,5091,1.5 hours,English,Paid,[ School of Game Design ],1090084,1,29,2013-07-18,2018-11-27,2499.0,449.0,Beginner Level,Design,Adobe Illustrator,No,Learn powerful illustration techniques in Adobe Illustrator master digital painting and graphic design with new skills!,https://www.udemy.com/course/adobe-illustrator-training/,https://img-c.udemycdn.com/course/750x422/65306_a9c7_5.jpg
Responsive Web Design Essentials - HTML5 CSS3 Bootstrap,2459618,4.71,20622,5011,16.5 hours,English,Paid,Daniel Walter Scott,11614232,1,126,2019-07-18,2021-12-19,3499.0,449.0,All Levels,Design,CSS,Yes,"The best course for learning the basics of HTML5 and CSS3 from scratch. Including 5 projects, perfect for beginners.",https://www.udemy.com/course/responsive-web-design-tutorial-course-html5-css3-bootstrap/,https://img-c.udemycdn.com/course/750x422/2459618_80a6.jpg
Manga Art School: Complete How to Draw Anime & Manga Course,1630508,4.36,30835,4942,11.5 hours,English,Paid,"Scott Harris • 450,000+ Enrolments",9055848,1,53,2018-04-20,2022-10-17,3499.0,449.0,Beginner Level,Design,Character Design,Yes,"Learn how to draw anime and how to draw manga, easily and professionally in this Manga Art Course",https://www.udemy.com/course/manga-art-school-anime-and-manga-style-character-drawing/,https://img-c.udemycdn.com/course/750x422/1630508_94eb_7.jpg
WordPress for Beginners: Create Your Own WordPress Website,1109602,4.34,220055,4854,8 hours,English,Paid,Phil Ebiner and Video School,"317821, 19701574",2,102,2017-03-11,2022-07-19,799.0,449.0,Beginner Level,Design,WordPress,No,Join our complete WordPress course to easily create a professional Wordpress website: no experience or coding necessary!,https://www.udemy.com/course/the-complete-wordpress-for-beginners-course/,https://img-c.udemycdn.com/course/750x422/1109602_1ef3_8.jpg
Complete Beginner's Guide to Digital Art,327666,4.39,33317,4707,23.5 hours,English,Paid,Rich Graysonn,5520332,1,126,2016-02-14,2022-02-24,3499.0,449.0,Beginner Level,Design,Digital Art,No,Master the foundations of digital drawing and illustration and create art like a pro,https://www.udemy.com/course/digital-art-101-from-beginner-to-pro/,https://img-c.udemycdn.com/course/750x422/327666_82b2_2.jpg
How to Draw and Sketch for Absolute Beginners pt 1,1047436,4.61,24956,4579,13 hours,English,Paid,Rich Graysonn,5520332,1,111,2017-01-25,2022-06-09,3499.0,449.0,Beginner Level,Design,Sketching,Yes,Learn the Basics of Sketching and Drawing,https://www.udemy.com/course/drawing-and-sketching-for-beginners/,https://img-c.udemycdn.com/course/750x422/1047436_97b3.jpg
The Digital Painting MEGA Course: Beginner to Advanced,1458304,4.59,38994,4509,16 hours,English,Paid,Austin Batchelor,21756796,1,115,2018-02-26,2022-09-28,3499.0,449.0,All Levels,Design,Digital Painting,No,Learn to paint in 7 different styles!,https://www.udemy.com/course/the-digital-painting-mega-course-beginner-to-advanced/,https://img-c.udemycdn.com/course/750x422/1458304_7c2b_4.jpg
Complete course in AutoCAD : 2D and 3D,2563480,4.37,156831,4480,16.5 hours,English,Paid,CADCIM Technologies,82217048,1,202,2019-10-13,2020-03-03,1499.0,449.0,All Levels,Design,AutoCAD,No,"For Architects, Engineers, and Designers",https://www.udemy.com/course/autocad-2020-for-designers-a-problem-solving-approach/,https://img-c.udemycdn.com/course/750x422/2563480_04e4_5.jpg
Affinity Designer: The Complete Guide to Affinity Designer,1407170,4.58,43947,4371,14 hours,English,Paid,Jeremy Hazel and Video School,"28389536, 19701574",2,140,2017-12-19,2022-11-06,3499.0,449.0,All Levels,Design,Affinity Designer,No,You can start using Affinity Designer V2 to start designing beautifully,https://www.udemy.com/course/affinity-designer-the-complete-guide-to-affinity-designer/,https://img-c.udemycdn.com/course/750x422/1407170_febb_3.jpg
Learn to Create Pixel Art for your Games,522596,4.61,19891,4366,5.5 hours,English,Paid,Benjamin Anderson,6813534,1,48,2016-01-04,2021-04-10,2299.0,449.0,Beginner Level,Design,Pixel Art,No,Improve your pixel art with these simple techniques and principles.,https://www.udemy.com/course/learn-to-create-pixel-art-for-your-game/,https://img-c.udemycdn.com/course/750x422/522596_f45e.jpg
UX Strategy Fundamentals,935870,4.48,16331,4355,2.5 hours,English,Paid,Joe Natoli,402489,1,33,2016-08-22,2016-08-22,1999.0,449.0,Beginner Level,Design,User Experience Design,No,"Practical principles and simple methods to make sure your app, site or system delivers GREAT UX!",https://www.udemy.com/course/ux-strategy-fundamentals/,https://img-c.udemycdn.com/course/750x422/935870_0bd8_3.jpg
How to Draw Cute Cartoon Characters,62497,4.7,21703,4285,2.5 hours,English,Paid,Ben Colefax,912787,1,27,2013-10-01,2020-06-15,2499.0,449.0,All Levels,Design,Cartoon Drawing,No,Learn the secrets to drawing cute cartoons quickly and easily,https://www.udemy.com/course/draw-cute-characters/,https://img-c.udemycdn.com/course/750x422/62497_e0f1_8.jpg
Canva Master Course | Learn Canva with Ronny,1626712,4.71,22936,4186,16.5 hours,English,Paid,Ronny Hermosa,26625950,1,79,2018-07-02,2022-10-03,3499.0,449.0,All Levels,Design,Canva,Yes,"Discover Canva, Build your Brand & Grow your Business or Career with a Canva Certified Expert",https://www.udemy.com/course/canva-master-course-graphic-design-for-beginners/,https://img-c.udemycdn.com/course/750x422/1626712_f569_3.jpg
The Complete Sketch 5 Course - Design Apps & Websites 2021,1855830,4.42,18729,4050,15.5 hours,English,Paid,Codestars • over 2 million students worldwide! and Rob Percival and Andrew Eddy and The Design Academy and Margot Dukes,"33231436, 4387876, 8800948, 50372790, 9284676",5,138,2018-08-22,2020-04-12,3499.0,449.0,All Levels,Design,Sketch Software,No,"Master Sketch software and learn a modern approach to designing mobile apps, websites, and everything UI/UX",https://www.udemy.com/course/sketchdesign/,https://img-c.udemycdn.com/course/750x422/1855830_155f_4.jpg
3ds Max + V-Ray: 3ds Max PRO in 6 hrs,269778,4.58,24045,4005,21 hours,English,Paid,Adam Zollinger,6783508,1,157,2014-08-26,2022-08-02,3499.0,449.0,Beginner Level,Design,3ds Max,Yes,"3ds Max intro course:  3Ds Max and V-Ray for creating 3D architectural imagery, from beginner to advanced",https://www.udemy.com/course/intro-to-architectural-visualization-using-3ds-max-and-v-ray_zillus/,https://img-c.udemycdn.com/course/750x422/269778_a286_16.jpg
Environment Art School: Complete Perspective Drawing Course,2068907,4.65,32242,3989,10 hours,English,Paid,"Scott Harris • 450,000+ Enrolments",9055848,1,51,2018-12-07,2022-10-17,3499.0,449.0,Beginner Level,Design,Drawing,Yes,"Learn How To Draw Landscapes, How to Draw Perspective, How to Draw Backgrounds and How to Draw Scenes and Create Worlds",https://www.udemy.com/course/perspective-art-school-environment-landscape-drawing-course/,https://img-c.udemycdn.com/course/750x422/2068907_8958_3.jpg
Logo Design in Adobe Illustrator - for Beginners & Beyond,595876,4.47,21055,3986,17.5 hours,English,Paid,Daniel Evans,5108286,1,266,2015-10-01,2022-09-08,3499.0,449.0,All Levels,Design,Logo Design,No,"Learn how to design a logo by a Published, Multi-Award Winning Logo Designer! 21+ Years Experience!",https://www.udemy.com/course/logodesign/,https://img-c.udemycdn.com/course/750x422/595876_f52f_20.jpg
Gamification & Behavioral Design: The Octalysis Framework,852028,4.65,21804,3906,3 hours,English,Paid,Yu-kai Chou,470636,1,21,2016-07-25,2019-02-19,7500.0,7500.0,All Levels,Design,User Experience Design,Yes,"Learn the 8 Core Drives that motivate us all (beyond Points, Badges, and Leaderboards)",https://www.udemy.com/course/gamification-behavioral-design-the-octalysis-framework/,https://img-c.udemycdn.com/course/750x422/852028_f146_3.jpg
Complete Houdini FX 19 Bootcamp,1227634,4.59,17071,3891,18 hours,English,Paid,Raffi Bedross,9859504,1,195,2017-06-07,2022-03-18,3499.0,449.0,Beginner Level,Design,Houdini Software,Yes,Beginners guide to Houdini FX 19 : The most powerful 3D application in the world. No prior knowledge required.,https://www.udemy.com/course/houdini-create-full-cg-chocolate-commercial-in-houdini/,https://img-c.udemycdn.com/course/750x422/1227634_053c_20.jpg
After Effects CC: The Ultimate Motion Graphics Masterclass,973762,4.66,94368,3767,23 hours,English,Paid,Louay Zambarakji,15601054,1,250,2016-12-19,2022-11-09,3499.0,449.0,All Levels,Design,Motion Graphics,No,Create Motion Graphics with Adobe After Effects CC: Best Techniques and Methods to Become a Top Motion Graphics Designer,https://www.udemy.com/course/adobe-after-effects-2017-essential-motion-graphics-training/,https://img-c.udemycdn.com/course/750x422/973762_010a_12.jpg
Complete Wordpress Training For Beginners,62768,3.8,39626,3707,4 hours,English,Paid,Eduonix Learning Solutions and Eduonix-Tech .,"598757, 15712140",2,20,2013-07-02,2018-12-04,799.0,449.0,All Levels,Design,WordPress,No,Learn to Build Wordpress Websites and Blogs from Scratch,https://www.udemy.com/course/complete-wordpress-course-for-beginners/,https://img-c.udemycdn.com/course/750x422/62768_bb14_8.jpg
"Graphic Design MasterClass- Photoshop, Illustrator, Indesign",1622484,4.44,99562,3696,34.5 hours,English,Paid,Khalil Ibrahim,16989726,1,212,2018-04-23,2022-11-08,3199.0,449.0,Beginner Level,Design,Graphic Design,No,"Graphic design for beginners including Graphic Design Theories, Photoshop, Illustrator, Indesign, CC & Creative Thinking",https://www.udemy.com/course/illustrator-cc-2018-for-beginners-basics-tricks/,https://img-c.udemycdn.com/course/750x422/1622484_652b_2.jpg
Complete Beginner's Guide to Anatomy and Figure Drawing pt1,880202,4.62,24546,3679,38.5 hours,English,Paid,Rich Graysonn,5520332,1,225,2016-06-20,2022-05-30,3499.0,449.0,Beginner Level,Design,Figure Drawing,No,Learn the Basics of anatomy and figure Drawing,https://www.udemy.com/course/anatomy-and-figure-drawing-for-games-and-comics/,https://img-c.udemycdn.com/course/750x422/880202_d1eb_4.jpg
Information Architecture (IA) Fundamentals,936690,4.41,17349,3677,2.5 hours,English,Paid,Joe Natoli,402489,1,30,2016-08-22,2016-08-25,1999.0,449.0,Beginner Level,Design,Information Architecture,Yes,Everything you need to know — from what content should be presented to what it’s called to how it’s organized!,https://www.udemy.com/course/ia-fundamentals/,https://img-c.udemycdn.com/course/750x422/936690_a231_3.jpg
UI/UX design with Adobe XD: Design & Prototype a Mobile App,1033446,4.54,11936,3633,2 hours,English,Paid,Luca Vavassori,16405580,1,14,2017-02-23,2017-11-06,1699.0,449.0,All Levels,Design,Adobe XD,No,Learn how to design a beautiful and engaging mobile app with Adobe Experience Design (XD). Learn-by-doing approach.,https://www.udemy.com/course/adobe-xd-course/,https://img-c.udemycdn.com/course/750x422/1033446_4080_2.jpg
AutoCAD Beginners Course,1570296,4.62,14583,3612,11.5 hours,English,Paid,Mike Freeman,34054694,1,78,2018-03-02,2022-05-26,3499.0,449.0,All Levels,Design,AutoCAD,No,Learn to use AutoCAD quickly & professionally by creating as you learn,https://www.udemy.com/course/autocad-2018-getting-started-quickly-with-autocad/,https://img-c.udemycdn.com/course/750x422/1570296_8091_7.jpg
Sketching for UX Designers - Boost UX work with pen & paper!,1170144,4.48,20442,3607,4.5 hours,English,Paid,Krisztina Szerovay and István Szép and Gergely Szerovay,"4982624, 7495694, 22389270",3,51,2017-04-15,2019-11-15,3299.0,449.0,All Levels,Design,User Experience Design,No,"Learn how to boost your UX design workflow with sketching user interfaces, animations and storyboarding.",https://www.udemy.com/course/sketching-for-ux-designers/,https://img-c.udemycdn.com/course/750x422/1170144_57f7_5.jpg
Master SketchUp  - A Definitive Guide From Infinite Skills,222122,4.46,15727,3506,5.5 hours,English,Paid,Infinite Skills,39032,1,111,2014-05-23,2017-01-06,2299.0,449.0,All Levels,Design,SketchUp,No,A easy to follow SketchUp course that teaches using practical examples.,https://www.udemy.com/course/master-sketchup/,https://img-c.udemycdn.com/course/750x422/222122_ad46_6.jpg
Ultimate Guide to Digital Sketching: Beginner to Advanced,1325264,4.57,33983,3400,5.5 hours,English,Paid,Austin Batchelor,21756796,1,42,2017-09-26,2019-11-26,3499.0,449.0,All Levels,Design,Sketching,No,Learn to digitally draw like a pro!,https://www.udemy.com/course/ultimate-guide-to-digital-sketching-beginner-to-advanced/,https://img-c.udemycdn.com/course/750x422/1325264_6025_3.jpg
Graphic Design Masterclass Intermediate: The NEXT Level,1824130,4.69,35435,3389,17 hours,English,Paid,Lindsay Marsh,16146540,1,133,2018-08-01,2021-10-05,3499.0,449.0,Intermediate Level,Design,Graphic Design,No,"Up Your Graphic Design Skills: Logo Design, Photo Manipulation, Package Design, Infographics, Portfolio Building, Grids!",https://www.udemy.com/course/graphic-design-masterclass-the-next-level/,https://img-c.udemycdn.com/course/750x422/1824130_66e3_3.jpg
Logo Design Mastery In Adobe Illustrator,2401332,4.71,15893,3385,6 hours,English,Paid,Lindsay Marsh,16146540,1,45,2019-06-08,2022-09-09,3499.0,449.0,All Levels,Design,Logo Design,Yes,"Learn Logo Design Theory, The Creative Process, How to Work With Clients & Master Adobe Illustrator Tools",https://www.udemy.com/course/logo-design-mastery-in-adobe-illustrator/,https://img-c.udemycdn.com/course/750x422/2401332_0c50_11.jpg
Learn Zbrush-Ultimate course 4 beginners/intermediate,1158660,4.71,14777,3269,34 hours,English,Paid,Milivoj Popovic,30663554,1,153,2019-04-02,2021-12-27,3399.0,449.0,Beginner Level,Design,zBrush,Yes,Zbrush Made Easy! Ultimate Zbrush 3d sculpting course for beginners/intermediate.,https://www.udemy.com/course/sculpting-in-zbrush/,https://img-c.udemycdn.com/course/750x422/1158660_b2f4_13.jpg
Adobe InDesign CC: Your Complete Guide to InDesign,1351634,4.71,247172,3264,6 hours,English,Paid,Phil Ebiner and Kurt Anderson and Video School,"317821, 16779544, 19701574",3,53,2017-10-13,2022-08-05,799.0,449.0,All Levels,Design,InDesign,No,"Become an Adobe InDesign CC Master: Learn the complete InDesign workflow to create PDFs, eBooks, pamphlets, and more!",https://www.udemy.com/course/adobe-indesign-course/,https://img-c.udemycdn.com/course/750x422/1351634_7dc7_5.jpg
Cinema 4D Masterclass: The Ultimate Guide for Beginners,1832808,4.73,11703,3253,8 hours,English,Paid,Ozgur Gorgun,47946074,1,89,2018-08-21,2021-09-01,2699.0,449.0,All Levels,Design,Cinema 4D,Yes,"Take your design skills to the next level, into the 3rd Dimension with this Cinema 4D Course",https://www.udemy.com/course/cinema-4d-masterclass-training-course/,https://img-c.udemycdn.com/course/750x422/1832808_2d0c_4.jpg
Fundamentals of Garden Design,1242820,4.51,13374,3208,6.5 hours,English,Paid,Rob Littlepage,4396732,1,75,2017-08-30,2022-08-07,2299.0,449.0,All Levels,Design,Landscape Architecture,Yes,An Introduction to Landscape Architecture and Design,https://www.udemy.com/course/fundamentals-of-garden-design/,https://img-c.udemycdn.com/course/750x422/1242820_a019.jpg
Adobe InDesign CC - Advanced Training Course,1512990,4.8,23352,3188,8.5 hours,English,Paid,Daniel Walter Scott,11614232,1,74,2018-01-22,2021-11-15,3499.0,449.0,Intermediate Level,Design,InDesign,No,"This Adobe InDesign tutorial is people wanting to up-skill their typography, color theory & graphic design abilities.",https://www.udemy.com/course/adobe-indesign-cc-advanced-training/,https://img-c.udemycdn.com/course/750x422/1512990_9384_2.jpg
course_title,course_id,course_avg_ratings,num_course_subscribers,num_course_reviews,course_length,course_language,course_type,course_instructor,course_instructor_id,num_course_instructor,num_course_lectures,course_publsihed_date,course_updated_date,course_list_price_inr,course_current_price_inr,course_instructional_level,course_category,course_label,is_course_bestseller,course_headline,course_url,course_image_url
The Ultimate Drawing Course - Beginner to Advanced,874012,4.62,492701,115937,11 hours,English,Paid,Jaysen Batchelor and Quinton Batchelor,"17082766, 32143518",2,64,2017-01-23,2022-03-16,3499.0,449.0,Beginner Level,Design,Drawing,Yes,"Learn the #1 most important building block of all art, Drawing. This course will teach you how to draw like a pro!",https://www.udemy.com/course/the-ultimate-drawing-course-beginner-to-advanced/,https://img-c.udemycdn.com/course/750x422/874012_c7f2_3.jpg
Character Art School: Complete Character Drawing,1259404,4.6,279982,61586,26.5 hours,English,Paid,"Scott Harris • 450,000+ Enrolments",9055848,1,115,2017-06-20,2022-10-17,3499.0,449.0,Beginner Level,Design,Character Design,Yes,"Learn How to Draw Characters Professionally, in the Ultimate Drawing Course - For Games, Manga, Animation and Comics",https://www.udemy.com/course/character-art-school-complete-character-drawing/,https://img-c.udemycdn.com/course/750x422/1259404_72d4_21.jpg
Complete Blender Creator: Learn 3D Modelling for Beginners,438522,4.68,280806,55005,48.5 hours,English,Paid,GameDev.tv Team and Rick Davidson and Grant Abbitt,"33027212, 24317920, 27282282",3,339,2015-05-05,2022-11-04,3499.0,449.0,All Levels,Design,Blender,Yes,"Use Blender to Create Beautiful 3D models for Video Games, 3D Printing & More. Beginners Level Course",https://www.udemy.com/course/blendertutorial/,https://img-c.udemycdn.com/course/750x422/438522_500f_7.jpg
Design Thinking in 3 Steps,1065056,4.38,106233,47741,1.5 hours,English,Paid,Designit Strategic Design and Alan Cooper,"27681436, 30777482",2,55,2017-04-03,2020-06-22,7500.0,7500.0,All Levels,Design,Design Thinking,Yes,"Understand your audience, envision a creative solution, and test your prototype",https://www.udemy.com/course/designit-design-thinking/,https://img-c.udemycdn.com/course/750x422/1065056_41ed_5.jpg
Graphic Design Masterclass - Learn GREAT Design,1643044,4.68,176491,45296,28.5 hours,English,Paid,Lindsay Marsh,16146540,1,222,2018-04-12,2022-08-29,3499.0,449.0,Beginner Level,Design,Graphic Design,Yes,"The Ultimate Graphic Design Course Which Covers Photoshop, Illustrator, InDesign,Design Theory, Branding and Logo Design",https://www.udemy.com/course/graphic-design-masterclass-everything-you-need-to-know/,https://img-c.udemycdn.com/course/750x422/1643044_e281.jpg
User Experience Design Essentials - Adobe XD UI UX Design,1452908,4.64,169745,42359,9.5 hours,English,Paid,Daniel Walter Scott,11614232,1,84,2017-12-05,2022-08-29,3499.0,449.0,All Levels,Design,User Experience Design,Yes,"Use XD to get a job in UI Design, User Interface, User Experience design, UX design & Web Design",https://www.udemy.com/course/ui-ux-web-design-using-adobe-xd/,https://img-c.udemycdn.com/course/750x422/1452908_8741_4.jpg
Illustrator 2022 MasterClass,1197206,4.65,145318,32037,13.5 hours,English,Paid,Martin Perhiniak,713757,1,114,2017-05-02,2021-10-27,3499.0,449.0,All Levels,Design,Adobe Illustrator,No,Master Adobe Illustrator with this in-depth training for all levels.,https://www.udemy.com/course/illustrator-cc-masterclass/,https://img-c.udemycdn.com/course/750x422/1197206_7201_4.jpg
Adobe After Effects: Complete Course from Novice to Expert,627730,4.66,148114,29724,35 hours,English,Paid,Louay Zambarakji,15601054,1,447,2015-11-02,2022-10-18,3499.0,449.0,All Levels,Design,After Effects,Yes,"Adobe After Effects CC Create stunning Motion Graphics, VFX Visual Effects & VFX Compositing with 50+ practice projects.",https://www.udemy.com/course/after-effects-kinetic-typography/,https://img-c.udemycdn.com/course/750x422/627730_83d0_33.jpg
Adobe Photoshop CC – Essentials Training Course,1747782,4.72,109152,28022,11 hours,English,Paid,Daniel Walter Scott,11614232,1,90,2018-06-15,2022-04-25,3499.0,449.0,Beginner Level,Design,Photoshop,Yes,This Adobe Photoshop Essentials course will teach you Photoshop Retouching as well as Photoshop for graphic design.,https://www.udemy.com/course/adobe-photoshop-cc-essentials-training-course/,https://img-c.udemycdn.com/course/750x422/1747782_399b_3.jpg
Ultimate Adobe Photoshop Training: From Beginner to Pro 2022,1046722,4.7,155048,27131,15.5 hours,English,Paid,Cristian Doru Barin,342181,1,193,2017-01-12,2022-10-03,3499.0,449.0,All Levels,Design,Photoshop,No,Master Adobe Photoshop CC 2022 without any previous knowledge with this easy-to-follow course,https://www.udemy.com/course/ultimate-photoshop-training-from-beginner-to-pro/,https://img-c.udemycdn.com/course/750x422/1046722_cbd7_6.jpg
Wordpress for Beginners - Master Wordpress Quickly,355212,4.64,106420,25313,9.5 hours,English,Paid,Andrew Williams,4851584,1,109,2014-12-15,2022-10-15,3499.0,449.0,Beginner Level,Design,WordPress,Yes,"In 2022, build a beautiful responsive Wordpress site that looks great on all devices.  No experience required.",https://www.udemy.com/course/wordpress-for-beginners-course/,https://img-c.udemycdn.com/course/750x422/355212_948a_10.jpg
Adobe Illustrator CC - Essentials Training Course,1514258,4.72,91627,22634,9.5 hours,English,Paid,Video School and Phil Ebiner and Daniel Walter Scott,"19701574, 317821, 11614232",3,46,2018-02-24,2022-04-25,3499.0,449.0,Beginner Level,Design,Adobe Illustrator,Yes,"Learn Adobe Illustrator CC graphic design, logo design, and more with this in-depth, practical, easy-to-follow course!",https://www.udemy.com/course/adobe-illustrator-course/,https://img-c.udemycdn.com/course/750x422/1514258_3768_3.jpg
The complete AutoCAD 2018-21 course,1271196,4.61,84927,22546,18 hours,English,Paid,Jaiprakash Pandey,8927912,1,186,2017-07-03,2022-05-29,1299.0,449.0,Beginner Level,Design,AutoCAD,Yes,A complete course for learning AutoCAD from scratch to professional level,https://www.udemy.com/course/autocad-2018-course/,https://img-c.udemycdn.com/course/750x422/1271196_5ffa_2.jpg
Web Design for Beginners: Real World Coding in HTML & CSS,246154,4.57,79920,22527,11 hours,English,Paid,Brad Schiff,5993622,1,71,2014-09-22,2020-07-12,3499.0,449.0,All Levels,Design,CSS,Yes,"Launch a career as a web designer by learning HTML5, CSS3, responsive design, Sass and more!",https://www.udemy.com/course/web-design-for-beginners-real-world-coding-in-html-css/,https://img-c.udemycdn.com/course/750x422/246154_d8b0_3.jpg
Adobe Photoshop CC: A Beginner to Advanced Photoshop Course,927356,4.58,511274,20323,16 hours,English,Paid,Phil Ebiner and Video School,"317821, 19701574",2,180,2016-08-22,2022-07-12,799.0,449.0,Beginner Level,Design,Photoshop,No,"You can learn Adobe Photoshop CC. Graphic Design, Photo Editing & Retouching,  Learn it all with this Photoshop class.",https://www.udemy.com/course/adobe-photoshop-course/,https://img-c.udemycdn.com/course/750x422/927356_8108_6.jpg
